{
  "schema_version": "1.0.0",
  "payload_type": "trajectory",
  "vertical": "retail",
  "snapshots": [
    {
      "month": 1,
      "as_of_date": "2025-03-01",
      "score": 30,
      "finding_count": 10,
      "resolved_count": 3
    },
    {
      "month": 2,
      "as_of_date": "2025-06-01",
      "score": 67,
      "finding_count": 5,
      "resolved_count": 4
    },
    {
      "month": 3,
      "as_of_date": "2025-09-01",
      "score": 85,
      "finding_count": 2,
      "resolved_count": 2
    }
  ]
}
